{
  "listing_id": "listing:golden-energy-support-fixture",
  "capsule_id": "cap_golden_energy_support_2026_q3",
  "visibility": "fixture_private",
  "review_level": "human_reviewed_with_caveats",
  "freshness": "current_with_stale_lineage",
  "caveats": ["Synthetic fixture", "Not legal advice", "Contains one stale lineage claim"],
  "rights_summary": "Internal fixture use only; automated legal opinion blocked."
}
